{
  "schema_version": 1,
  "version": {
    "sources": [
      {
        "type": "text",
        "path": "VERSION"
      },
      {
        "type": "json",
        "path": "package.json",
        "selector": "version"
      },
      {
        "type": "toml",
        "path": "pyproject.toml",
        "selector": "project.version"
      }
    ]
  },
  "notes": {
    "path_template": "docs/V{version}.md",
    "changelog_path": "CHANGELOG.md",
    "changelog_heading_template": "## [{version}]"
  },
  "build": {
    "script": ".prodkit/workflows/release-build.sh",
    "artifact_dir": "dist/release",
    "source_archive": true
  },
  "release": {
    "name_template": "{repository} {tag}"
  }
}
